{
  "trip": {
    "city": "Vijayawada",
    "numberOfDays": 2,
    "hoursPerDay": 8
  },
  "destinations": [
    {
      "id": 1,
      "name": "Undavalli Caves",
      "latitude": 16.4855,
      "longitude": 80.5560,
      "visitDurationHours": 2,
      "category": "Historical",
      "description": "Rock-cut cave temples dating to the 4th-5th century, carved into a sandstone hill overlooking the Krishna river.",
      "imageUrl": "https://example.com/images/undavalli-caves.jpg"
    },
    {
      "id": 2,
      "name": "Kondapalli Fort",
      "latitude": 16.6150,
      "longitude": 80.5420,
      "visitDurationHours": 2,
      "category": "Historical",
      "description": "A 14th-century hill fort known for panoramic views and its role in the region's toy-making craft.",
      "imageUrl": "https://example.com/images/kondapalli-fort.jpg"
    },
    {
      "id": 3,
      "name": "Amaravati Stupa",
      "latitude": 16.5730,
      "longitude": 80.3580,
      "visitDurationHours": 2,
      "category": "Historical",
      "description": "Remains of a 2nd-century BCE Buddhist stupa, once among the largest in India, with an adjoining archaeological museum.",
      "imageUrl": "https://example.com/images/amaravati-stupa.jpg"
    }
  ],
  "route": [
    { "from": "Undavalli Caves", "to": "Kondapalli Fort", "distanceKm": 25 },
    { "from": "Kondapalli Fort", "to": "Amaravati Stupa", "distanceKm": 30 },
    { "from": "Undavalli Caves", "to": "Amaravati Stupa", "distanceKm": 18 }
  ],
  "feasibility": {
    "feasible": true,
    "estimatedRequiredHours": 9.5,
    "availableHours": 16
  },
  "hotels": [
    {
      "id": 101,
      "name": "Krishna Riverside Inn",
      "latitude": 16.505,
      "longitude": 80.61,
      "pricePerNight": 3500,
      "rating": 4.3,
      "amenities": ["WiFi", "Parking", "Restaurant", "AC"]
    },
    {
      "id": 102,
      "name": "Grand Vijayawada Palace",
      "latitude": 16.70,
      "longitude": 80.75,
      "pricePerNight": 4500,
      "rating": 4.8,
      "amenities": ["WiFi", "Pool", "Spa", "Restaurant", "Gym"]
    },
    {
      "id": 103,
      "name": "Budget Stay Vijayawada",
      "latitude": 16.52,
      "longitude": 80.62,
      "pricePerNight": 1800,
      "rating": 3.9,
      "amenities": ["WiFi", "Parking"]
    }
  ],
  "preferences": {
    "budget": "mid-range",
    "interests": ["history", "architecture"],
    "travelStyle": "relaxed",
    "groupType": "couple"
  }
}
